211042604|뽀시래기 악녀로 살아남는 방법(15세 개정판)|서로|루시노블|2023-05-10|2023-05-10 06:58:00|서양풍 로판|75|132|153|<b>&lt;책소개&gt;</b><br><br>* 키워드 : 서양풍, 판타지물, 역하렘, 게임물, 능력남, 카리스마남, 까칠남, 집착남, 후회남, 능글남, 무심녀, 털털녀, 왕족/귀족, 여주중심<br><br><br>역하렘 시뮬레이션 게임 속에 빙의해 버렸다.<br>악녀 캐릭터 옆에서 여주인공을 괴롭히는 데에<br>한몫 제대로 보태는 뽀시래기 악녀, ‘이블린 루이’로.<br><br>여주인공 에이미의 행복을 방해하면 제거당하는 세계관에서<br>어떻게든 살아남기 위해 아무 짓도 안 하고 가만히 있으려 했다.<br><br>그런데…… 뭔가 이상하다?<br><br>“나도 이 감정이 뭔지 모르겠어.”<br>날 미워하던 양오빠 제르반은 물론.<br><br>“뭐든 해 줄 수 있어요. 정말로요.”<br>훗날 황실 기사단장이 되는 에녹.<br><br>“내 황태자비가 되어 줘, 이블린.”<br>항상 나에게만 쌀쌀맞고 냉정하던 황태자 요한에,<br><br>“반역에 성공한다면…… 그래, 황후는 너로 할까.”<br>원작의 흑막인 테오까지 에이미가 아닌 나에게 호감을 보인다.<br><br>‘뭔가 달라지고 있는 게 분명해.’<br><br>내 의지와는 정반대로, 원작이 뒤바뀌기 시작했다.|0|1|0|2023-10-13 00:00:00
211042685|뽀시래기 악녀로 살아남는 방법|서로|루시노블|2023-05-10|2023-05-10 06:58:00|서양풍 로판|2963|527|153|<b>&lt;책소개&gt;</b><br><br>* 키워드 : 서양풍, 판타지물, 역하렘, 게임물, 능력남, 카리스마남, 까칠남, 집착남, 후회남, 능글남, 무심녀, 털털녀, 왕족/귀족, 여주중심<br><br><br>역하렘 시뮬레이션 게임 속에 빙의해 버렸다.<br>악녀 캐릭터 옆에서 여주인공을 괴롭히는 데에<br>한몫 제대로 보태는 뽀시래기 악녀, ‘이블린 루이’로.<br><br>여주인공 에이미의 행복을 방해하면 제거당하는 세계관에서<br>어떻게든 살아남기 위해 아무 짓도 안 하고 가만히 있으려 했다.<br><br>그런데…… 뭔가 이상하다?<br><br>“나도 이 감정이 뭔지 모르겠어.”<br>날 미워하던 양오빠 제르반은 물론.<br><br>“뭐든 해 줄 수 있어요. 정말로요.”<br>훗날 황실 기사단장이 되는 에녹.<br><br>“내 황태자비가 되어 줘, 이블린.”<br>항상 나에게만 쌀쌀맞고 냉정하던 황태자 요한에,<br><br>“반역에 성공한다면…… 그래, 황후는 너로 할까.”<br>원작의 흑막인 테오까지 에이미가 아닌 나에게 호감을 보인다.<br><br>‘뭔가 달라지고 있는 게 분명해.’<br><br>내 의지와는 정반대로, 원작이 뒤바뀌기 시작했다.|0|1|1|2023-10-13 00:00:00
211044336|이런 회귀는 바라지 않았다|멜리타|루시노블|2023-06-19|2023-06-19 06:58:00|서양풍 로판|2966|154|134|<b>&lt;책소개&gt;</b><br><br>서양풍, 판타지물, 삼각관계, 능력남, 직진남, 능글남, 다정남, 순정남, 오만남, 능력녀, 철벽녀, 무심녀, 우월녀, 회귀/타임슬립, 영혼체인지/빙의, 초월적존재, 왕족/귀족, 복수<br><br>혹독한 후계 싸움 끝에 억울한 죽음을 맞이한<br>제국의 제1 황녀 로잘리아 아카이젠.<br><br>6년 전으로 회귀한 것까지는 좋았는데<br>하필이면 키우던 고양이 체리와 영혼이 바뀌었다!<br><br>원래의 몸으로 돌아가기 위해 고군분투하는 그녀의 앞에<br>자꾸만 나타나 신경을 긁어 대는 남자, 일리드 카프로스.<br><br>신비롭고 아름다운 미모의 소유자이자<br>마탑 소속 천재 마법사인 일리드는<br>고양이의 몸을 한 그녀를 알아보고 조력자를 자처한다.<br><br>로잘리아는 반복되는 악몽 속에서<br>자신을 구하는 은발의 ‘존재’가 일리드임을 깨닫지만<br>불의 정령왕 피닉스의 개입으로 상황은 꼬여 가고<br><br>설상가상으로 회귀 전과 조금씩 달라지는 상황은<br>로잘리아를 불안하게 만드는데……<br><br>과연 그녀는 원래의 몸을 찾고<br>‘완벽한 후계자’가 되어 복수에 성공할 수 있을까?<br><strong><br>“당신은 그 잘난 놈을 손에 넣은 거다.<br>그러니 할 수 있는 만큼 써먹어야지.<br>외간 놈을 끌어들이는 게 아니라.”</strong>|0|1|0|2023-10-13 00:00:00
211044505|나를 죽인 당신에게|진수윤(까망소금)|루시노블|2023-06-28|2023-06-28 06:58:00|서양풍 로판|3127|501|144|<b>&lt;책소개&gt;</b><br><br>오만함이 내뱉는 숨결같이 당연한 남자. 귀족 중의 귀족. 사랑을 위해 주변을 모조리 불살라 버린 남자.<br>그게 바로 내 남편, 커티스였다.<br>나는 ‘한 여자’인 이르벨린이 커티스의 사랑이 되는 순간 그의 손에 죽어 없어질 아내였을 뿐.<br><br>남편의 손에 죽어 회귀한 나는 살기 위해 연기를 시작했다.<br>앞으로 1년 후, 나를 죽일 남편에게서 벗어날 일생일대의 연기를.<br><br>*<br><br>“달리아. 시간을…… 당신과 나 사이의 시간을 그렇게 아무것도 아니라고 말하지 마십시오.”<br>“아무것도 아니면요?”<br><br>되묻는 달리아의 목소리와 표정이 너무나도 잔잔하고 한편으로는 성의 없어 보였기에 커티스는 말문이 막혔다.<br>평생 누구 앞에서도 타의로 입을 닫은 적이 없는 그의 혀가 처음으로 굳어졌다.<br>그리고 커티스의 곁에 있을 때는 단 한 번도 제대로 말해 본 적 없는 달리아의 창백한 입술은 종달새처럼 속닥거렸다.<br><br>“아무것도 아니에요. 공작님. 그 시간은 아무것도 아니라고요.”<br><br>누군가와의 관계는 함께 보낸 시간에 비례하지 않는다. 첫눈에 서로에게 반하기도 하고, 몇십 년 동안 곁에 있어도 그저 데면데면한 사이로 남기도 하는 것처럼.<br><br>“켜켜이 쌓여 돌아볼 시간 같은 거.”<br><br>달리아는 나붓이 미소하며 커티스와 애초부터 없었던 관계의 종언을 고했다.<br><br>“없잖아요. 우리.”|0|1|0|2023-10-14 00:00:00
211045409|공포 게임 속에서 미연시는 사양합니다|청시노|루시노블|2023-07-28|2023-07-28 06:58:00|서양풍 로판|2786|473|100|<b>&lt;책소개&gt;</b><br><br>공포 게임 〈러브 인 호러〉에<br>‘제물’로 빙의한 ‘루다’<br>‘귀신’들을 피해 살아남아야 하는데……!<br><br>[‘지옥 모드’가 자동으로 선택됩니다.]<br><br>게임할 때는 몰랐던 지옥 모드가 열리고 만다.<br>그뿐만 아니라,<br><br>[귀신의 밤에서 살아남은 후, 진 엔딩 조건을 달성하세요!]<br><br>갑자기 진 엔딩이라니?<br><br>게임에서 탈출하고 싶었던 루다는<br>결국 남주들을 공략하여 끝을 보기로 결심하고<br><br>[율리안의 호감도가 상승합니다.]<br>[테오의 호감도가 상승합니다.]<br>[에스테반의 호감도가 상승합니다.]<br><br>과연 그녀는 저주받은 하일리크 저택의 비밀을 풀고<br>진 엔딩을 달성해 게임에서 탈출할 수 있을까?<br><br>“무서워서 그러나?<br>그렇다면 내가 같이 가 주고.”|0|1|1|2023-10-12 00:00:00
211045410|공포 게임 속에서 미연시는 사양합니다(15세 개정판)|청시노|루시노블|2023-07-28|2023-07-28 06:58:00|서양풍 로판|64|89|96|<b>&lt;책소개&gt;</b><br><br>공포 게임 〈러브 인 호러〉에<br>‘제물’로 빙의한 ‘루다’<br>‘귀신’들을 피해 살아남아야 하는데……!<br><br>[‘지옥 모드’가 자동으로 선택됩니다.]<br><br>게임할 때는 몰랐던 지옥 모드가 열리고 만다.<br>그뿐만 아니라,<br><br>[귀신의 밤에서 살아남은 후, 진 엔딩 조건을 달성하세요!]<br><br>갑자기 진 엔딩이라니?<br><br>게임에서 탈출하고 싶었던 루다는<br>결국 남주들을 공략하여 끝을 보기로 결심하고<br><br>[율리안의 호감도가 상승합니다.]<br>[테오의 호감도가 상승합니다.]<br>[에스테반의 호감도가 상승합니다.]<br><br>과연 그녀는 저주받은 하일리크 저택의 비밀을 풀고<br>진 엔딩을 달성해 게임에서 탈출할 수 있을까?<br><br>“무서워서 그러나?<br>그렇다면 내가 같이 가 주고.”|0|1|0|2023-10-11 00:00:00
211045644|검은 늑대의 소유가 되었습니다|이지안(감각)|루시노블|2023-08-04|2023-08-04 06:58:00|서양풍 로판|2773|652|116|<b>&lt;책소개&gt;</b><br><br>한 여자가 설원에서 죽어 가고 있었다.<br>동족을 위협하는 마녀라는 누명을 쓴 채.<br><br>그때, 사신을 닮은 남자가 찾아와<br>순식간에 여자를 구해 내더니 성으로 데리고 갔다.<br><br>남자의 정체는 ‘악마를 집어삼킨 검은 늑대’라 불리는, 켄나드.<br>그는 기억을 잃은 채 깨어난 여자에게 이름과 방을 내주었다.<br><br>엘레나는 그렇게 켄나드의 소유가 되었다.<br>동시에 그녀는 차갑고 잔혹한 그의 유일한 예외였다.<br><br>이름도, 정체도 알 수 없는 자신을 은근히 걱정하거나<br>짙은 페로몬을 풍기며 강한 집착을 보이는 켄나드의 곁에서<br><br>엘레나는 두려움 너머로 다른 감정이 움트는 것을 느꼈다.<br>품어서는 안 될 마음이었다.<br><br>게다가 성으로 찾아온 켄나드의 약혼자까지,<br>엘레나는 그를 향한 마음이 더 커지기 전에 떠나려 하는데…….<br><br>“넌 내 것이다.<br>내게서 벗어날 수 있을 거라 생각하지 마.”|0|1|1|2023-10-13 00:00:00
211045645|검은 늑대의 소유가 되었습니다(15세 개정판)|이지안(감각)|루시노블|2023-08-04|2023-08-04 06:58:00|서양풍 로판|58|85|109|<b>&lt;책소개&gt;</b><br><br>한 여자가 설원에서 죽어 가고 있었다.<br>동족을 위협하는 마녀라는 누명을 쓴 채.<br><br>그때, 사신을 닮은 남자가 찾아와<br>순식간에 여자를 구해 내더니 성으로 데리고 갔다.<br><br>남자의 정체는 ‘악마를 집어삼킨 검은 늑대’라 불리는, 켄나드.<br>그는 기억을 잃은 채 깨어난 여자에게 이름과 방을 내주었다.<br><br>엘레나는 그렇게 켄나드의 소유가 되었다.<br>동시에 그녀는 차갑고 잔혹한 그의 유일한 예외였다.<br><br>이름도, 정체도 알 수 없는 자신을 은근히 걱정하거나<br>짙은 페로몬을 풍기며 강한 집착을 보이는 켄나드의 곁에서<br><br>엘레나는 두려움 너머로 다른 감정이 움트는 것을 느꼈다.<br>품어서는 안 될 마음이었다.<br><br>게다가 성으로 찾아온 켄나드의 약혼자까지,<br>엘레나는 그를 향한 마음이 더 커지기 전에 떠나려 하는데…….<br><br>“넌 내 것이다.<br>내게서 벗어날 수 있을 거라 생각하지 마.”|0|1|0|2023-10-13 00:00:00
211046408|저는 여기서 빠지겠습니다|세히야|루시노블|2023-08-28|2023-08-28 06:58:00|서양풍 로판|2946|428|94|<b>&lt;책소개&gt;</b><br><br>마법이 통하지 않는 ‘면역자’로 태어난 엘리니아.<br>그 때문에 시한부 인생을 살고 있었다.<br><br>설상가상 가문도 몰락 직전이라<br>아등바등 빚을 갚는 것에 전념하던 어느 날.<br>황실 기사단 소속인 친오빠한테서 터무니없는 부탁을 받는다.<br><br>“단장이 여자인 걸 들키지 않게 네가 반한 척 좀 해 줘.”<br><br>졸지에 ‘남장 여자’에게<br>사랑한다고 열렬히 고백하며 따라다니고 있던 그때.<br><br>무례하고 재수 없으며<br>어딘가 수상해 보이는 남자를 만났다.<br><br>“바로 뒤에 있는 낭떠러지로 떨어지기 싫다면 계속 안고 있어.”<br><br>그의 정체는 바로,<br>다른 공작 가문의 적자이자<br>‘마탑의 망나니’라고 악명 높은 천재 마법사인<br>리카일 카르다움이었다.<br><br>“이제 와서 도망칠 생각은 하지 않는 게 좋아.”<br><br>“저……. 그런 말을 들을 정도로 저희가 친분이 있진 않다고 보는데요.”<br><br>타인에게 결코 곁을 주지 않는 그가<br>그녀에게만은 적극적으로 다가오기 시작한다.<br><br>어차피 얼마 못 사는 인생.<br>그에게 상처 주기 싫어 처음엔 리카일을 밀어냈던 엘리니아도<br>어느새 그에게 설레기 시작하는데……!<br><br>“너의 인생이 행복만 가득했으면 좋겠어.”<br><br>여자는 거들떠보지도 않는 사람이 어째서 그녀한테만은 다정한 걸까?|0|1|0|2023-10-14 00:00:00
211046927|늑대의 하나뿐인 반려가 되었습니다|소휘(Sohwi)|루시노블|2023-09-12|2023-09-12 06:58:00|서양풍 로판|2949|337|86|<b>&lt;책소개&gt;</b><br><br>레푸스 가문에서 태어났지만<br>버림받은 비운의 딸, 솔리타리에는<br>일촉즉발의 상황에서 하인리히를 만난다.<br><br>“살고 싶어?<br><br>그에게 구원받은 솔리타리에는<br>어쩌다 보니 그의 반려까지 되어 버렸다.<br>아니, 정확히는 ‘가짜 반려’였다.<br><br>“이건 사기야!”<br><br>펄펄 뛰어도 그는 고집을 굽히지 않았다.<br>어쩔 수 없이 그의 반려로서 지내며<br>평화로운 생활을 영위하는 듯했으나<br><br>하인리히와 적대 관계인 티그리스 가문은<br>사사건건 그녀에게 해를 입히려 안달이었고,<br><br>설상가상으로 그녀는 자신의 정체에 대한 비밀을 알게 되며<br>하인리히에게서 떠나기로 결심하는데…….<br><br>“소꿉놀이는 끝났어요.”<br><br><br>도망, 재회, 순정남, 순진녀|0|1|0|2023-10-13 00:00:00
211047308|입술이 스치면 인연|곰내곰|루시노블|2023-09-18|2023-09-18 06:58:00|동양풍 로판|2947|584|73|<b>&lt;책소개&gt;</b><br><br>동제국에서 대사가 도착했다.<br>선이 또렷한 얼굴, 훤칠한 키의 13 황자 여호결.<br><br>그를 맞이한 것은 모두의 사랑을 받는<br>서제국의 황녀, 인피네타였다.<br><br>두 사람이 처음 만난 순간,<br>호결은 그녀가 가진 특별한 힘이 자신의 유일한 구명줄임을 깨달았고<br>인피네타는 처음으로 열렬히 끓어오르는 마음을 느꼈다.<br><br>이해관계가 일치하니 결혼까지는 속전속결이었다.<br>초야까지 잘 치르고 이제 행복할 일만 남았다고 생각했는데…….<br><br>인피네타는 호결이 자신과 첫날밤을 보내지 않았음과<br>‘어떠한 힘’ 때문에 자신을 이용하려 결혼하였음을 알게 된다.<br><br>인피네타의 힘이 필요한 호결과 그의 마음을 원하는 인피네타.<br>과연 상대를 먼저 함락시켜 목적을 이룰 사람은 누구일까?<br><strong><br>“이, 익숙하시네요. 어디서 연습하신 거예요?”<br>“부인에 대해 모르는 것이 있어서야 되겠습니까.”</strong>|0|1|1|2023-10-13 00:00:00
211047309|입술이 스치면 인연(15세 개정판)|곰내곰|루시노블|2023-09-18|2023-09-18 06:58:00|동양풍 로판|68|85|67|<b>&lt;책소개&gt;</b><br><br>동제국에서 대사가 도착했다.<br>선이 또렷한 얼굴, 훤칠한 키의 13 황자 여호결.<br><br>그를 맞이한 것은 모두의 사랑을 받는<br>서제국의 황녀, 인피네타였다.<br><br>두 사람이 처음 만난 순간,<br>호결은 그녀가 가진 특별한 힘이 자신의 유일한 구명줄임을 깨달았고<br>인피네타는 처음으로 열렬히 끓어오르는 마음을 느꼈다.<br><br>이해관계가 일치하니 결혼까지는 속전속결이었다.<br>초야까지 잘 치르고 이제 행복할 일만 남았다고 생각했는데…….<br><br>인피네타는 호결이 자신과 첫날밤을 보내지 않았음과<br>‘어떠한 힘’ 때문에 자신을 이용하려 결혼하였음을 알게 된다.<br><br>인피네타의 힘이 필요한 호결과 그의 마음을 원하는 인피네타.<br>과연 상대를 먼저 함락시켜 목적을 이룰 사람은 누구일까?<br><strong><br>“이, 익숙하시네요. 어디서 연습하신 거예요?”<br>“부인에 대해 모르는 것이 있어서야 되겠습니까.”</strong>|0|1|0|2023-10-13 00:00:00
425228411|상자 속의 마리골드|쿼츠|스텔라|2021-07-06|2021-07-06 06:58:00|서양풍 로판|1507|716|229|<b>&lt;책소개&gt;</b><br><br>개발 중단된 가상 현실 게임 &lt;상자 속의 마리골드&gt;<br><br>불의의 사고로 개발이 중단되고,<br>개발팀장으로서의 책임감과 아쉬운 마음을 감추지 못해<br>마지막으로 게임에 접속했는데……<br><br>캐릭터 설정도, 로그아웃도 되지 않는다?!<br><br>강제로 주인공 ‘클로에 마리골드’가 된 그녀.<br><br>어쩔 수 없지.<br>빠른 자살로 데드엔딩을 보고 현실로 탈출하는 수밖에.<br><br>하지만 NPC들의 방해로 데드엔딩은 계속해서 실패하고,<br>겨우 성공하나 했더니…… 다시 게임 속이다.<br><br>이제 남은 방법은 하나뿐이다.<br>목표는 게임 클리어.<br><br>***<br><br>그리고 그런 그녀에게 찾아온 NPC 나인.<br><br>“괜찮은 방법이지만 위험했어요.”<br>“알았어요, 조심할게요. 그래도 나인이 절 구하러 오기로 약속했잖아요. 이렇게 와주셨으니 된 거 아닌가요?”<br>“…….”<br><br>나인이 할 말을 잃은 표정으로 그녀를 바라봤다.<br>시스템 메시지가 굳어버린 그의 반응을 대신했다.<br><br>[나인 비비의 호감도가 상승합니다.]<br><br>가엽게도 그는 자기 호감도가 어떻게 표시되는지 알 수 없었다.|0|1|0|2023-09-29 00:00:00
425270925|어두운 바다의 등불이 되어|연산호|문피아|2022-03-21|2022-03-21 03:00:00|현대 판타지|2834|20055|366|<b>&lt;책소개&gt;</b><br><br>3,000m 아래 해저기지에<br>입사한 지 닷새 만에 물이 샌다고?|0|1|0|2023-10-13 00:00:00
777099468|말 못 하는 공작 부인|소낭밧|디앤씨북스|2022-03-23|2022-03-23 06:58:00|서양풍 로판|2578|2288|188|<b>&lt;책소개&gt;</b><br><br>로엔그린에게는 8년 된 약혼자가 있었다.<br>그녀가 목소리를 잃은 이후에도, 파혼하지 않고 굳건히 옆을 지킨 남자였다.<br>그와 혼인을 앞두고 있던 때,<br>약혼자에게 내연녀와 5살 난 아들이 있단 사실을 알았다.<br>그의 기만은 자신이 관용을 베풀 수 있는 범위를 넘어섰다.<br><br>그런데.<br><br>“너무 놀라 말을 잊으신 걸까요. 아니면, 원래 말을 못 하시던가?”<br><br>윈베르겐의 수치, 베른의 탕아, 황제의 잡견.<br>윈베르겐의 사생아, 칼라일 안스가르.<br><br>이자는 왜.<br><br>“바라는 게 무엇인가?”<br>“혼약.”<br><br>이때를 기다렸다는 듯 나타나는지.|0|1|0|2023-10-13 00:00:00
793016326|조연 인생 18년 차 회귀 후 깨달은 것|양지|다카포|2022-11-27|2022-11-27 06:58:00|서양풍 로판|2816|595|254|<b>&lt;책소개&gt;</b><br><br>“세실리아!”<br><br>아, 빛이 들어온다.<br><br>마차의 나무판을 뜯어내고 세 남자와 눈이 마주쳤다. <br>이름 따위 안 불러 줘도 상관없어. 구해만 준다면 말이야.<br><br>그러나….<br>그들은 곧바로 내게서 고개를 돌리더니 반대편의 세실리아만을 구해 갔다. <br>다시 돌아올 것이라고 생각했는데, 세실리아를 부르는 목소리만 희미하게 멀어져갈 뿐이었다.<br><br>그러니까 지금… 나 버림받은 거네?<br>아니, 아무리 그래도 두고 가는 건… 씨발!<br><br>나 안 해.<br>세실리아 친구 안 해.<br>조연 인생 안 해!<br>지들이 뭐 얼마나 잘났다고!<br><br>꺼져 가는 시야 속에서 나는 다짐했다.<br><br><br>***<br><br><br>가슴이 쿵쾅거렸다.<br><br>“리아나! 그게 무슨 말이야.”<br><br>“세실리아, 넌 아마 평생 모를 거야.”<br><br>이것만큼은 단언할 수 있었다.<br><br>허상인지 실제인지 달리던 마차가 전복되기까지의 일들, <br>너를 보호하려 애썼던 날들, <br>어울리려고 노력했던 수많은 날 사이사이의 눈물들.<br>내가 받은 보답은, 버림이었다.<br><br>나를 두고 세실리아 너만을 구해 갔던 세 남자의 잔상이 이토록 뚜렷한데.<br><br>나는 숨을 깊이 쉬었다.<br>폐부를 찌르는 상쾌한 공기가 날카롭게 느껴지는 건 내 착각이겠지.|0|1|0|2023-10-12 00:00:00
809019858|유혹의 늪|늦겨울|동아|2019-02-08|2019-02-08 11:00:32|서양풍 로판|237|1439|192|<b>&lt;책소개&gt;</b><br><br>#가상시대물 #판타지물 #서양풍 #회귀 #역하렘 #복수 #귀족 #신분차이 #갑을관계 #삼각관계 #여공남수 #조신남 #직진남 #애교남 #유혹남 #절륜남 #순정남 #다정남 #동정남 #존댓말남 #대형견남 #연하남 #능력녀 #절륜녀 #고수위 #하드코어 #BL소설빙의 #SM<br><br><br>레이첼은 이 세상이 전생에 읽었던 고수위 BL 소설이라는 것을 깨달았다.<br>자신은 메인공, 라이오넬에게 곧 죽을 예정인 약혼녀.<br>하지만 레이첼은 그의 마음을 꿰차고 운명을 바꿀 수 있으리라 착각한다.<br><br>그러나 라이오넬과 결혼 후, 모든 것이 무너졌다.<br>강압적인 성관계, 오라비의 실종, 가문의 멸문까지.<br>결국, 남편의 애첩인 제프리를 분풀이 상대로 삼아 모질게 학대하다 라이오넬의 손에 죽는데…….<br><br>그리고 그에게 듣게 되는 충격적인 진실.<br><br>[네 오라비의 행방불명은 내가 사주했어. 뜬금없이 반역에 휘말린 너희 가문도, 전부 내가.]<br><br>허망하게 죽고 끝나는 줄 알았건만, 눈을 떠 보니 19년 전의 파릇파릇한 과거.<br>레이첼은 사랑하는 사람들을 지키고, 라이오넬에게 복수할 수 있을까?<br><br>그렇게 레이첼은 세 남자와 유혹의 늪에서 다시 엮이게 되는데.<br><br>회귀하기 전, 레이첼의 정부였던 니콜라스.<br>레이첼에게 학대받던 남편의 애첩, 제프리.<br>거짓 증언으로 가문을 배신했던 시메온.<br><br>“후회 안 할 거지?”<br>“절대. 부디, 마음 가는 대로 해 주십시오.”<br><br><br><b>&lt;저자 소개&gt;</b><br><br>늦겨울<br>여성을 위한 섹슈얼 로맨스를 쓰고 싶습니다.|0|1|1|2023-10-13 00:00:00
809044458|호감도는 안 돼요, 공녀님!|서은|동아|2023-04-26|2023-04-26 06:58:00|서양풍 로판|3008|395|128|<b>&lt;책소개&gt;</b><br><br>[아샤 자꾸 죽는데 이거 어떻게 살림?]<br><br>내 최애캐는 호감도가 70 이상이 되면 죽어 버리는 개복치 호위 기사다.<br>이 남자를 사랑으로 혼내 주지 않으면 직성이 풀리지 않을 것 같아서 <br>어떻게든 해피 엔딩을 보기 위해 고군분투하는 와중, 망겜에 빙의되어 버렸다.<br><br>다름 아닌, 내 최애캐에게.<br>그리고 새로운 사실을 깨닫게 되는데….<br><br>“……아샤 남캐 아니었어?”<br><br>남캐로 알고 있던 최애캐가 여캐였다.<br>심지어 공작가의 사생아에, 주인공 동생이라고?<br>어쩐지 루트가 더럽게 안 열리더라!<br><br>* * *<br><br>나는 리리아에게 계약 결혼 루트를 열어 줄 생각이었다.<br>그럼 리리아는 공작가로 가고, 나도 호감도의 굴레에서 벗어나고 일석이조니까.<br>그런데.<br><br>“잘됐네. 마침 아샤 경을 찾고 있었거든.”<br><br>리리아랑 이어 주려던 공작이 나를 찾았단다. 나를 왜?<br><br>“어때? 공작가 안주인 자리에 취직하지 않을래?”<br><br>그의 입에서 나오는 모든 문장이 이해가 되지 않았다.<br>아니 이거, 이게…. 이 고백이 리리아에게 가야 할 텐데…?<br><br>“나랑 결혼해, 아샤 경.”<br><br>당신 번지수 잘못 찾으셨는데요?!<br>나, 아무래도 원작을 잘못 틀어 버린 모양이다…….<br><br><br><b>&lt;저자 소개&gt;</b><br><br>서은|0|1|0|2023-10-12 00:00:00
