3885017977|마스터피스|별샴푸|델피뉴|2023-08-11|2023-08-11 06:58:00|서양풍 로판|3933|524|98|"<b>&lt;책소개&gt;</b><br><br><img src=""//misc.ridibooks.com/desc.intro/3885017977""/><br><br><strong>*본 작품은 리디 웹소설에서 동일한 작품명으로 15세이용가와 19세이용가로 동시 서비스됩니다.<br>연령가에 따라 일부 장면 및 스토리 전개가 상이할 수 있으니, 연령가를 선택 후 이용해 주시길 바랍니다.</strong><br><br>알파라는 이유로 천대받는 화가, ‘쿠벤 와이어스’.<br>초상화 의뢰를 받은 공작 저택에서 특별한 공작 영애, ‘페시아 키호테’를 만나게 된다.<br><br>“……그쪽, 알파예요?”<br>“예, 알파입니다.”<br><br>쿠벤의 삶은 틀에 박힌 듯 평범했다. 알파이기에 당하는 핍박조차 익숙했다.<br><br>“그렇군요…….”<br><br>페시아를 만나기 전까지는.<br>아가씨는 방금 화가가 한 말을 듣지 못한 사람처럼 굴었다.<br><br>‘정말 아무렇지 않은가?’<br><br>그녀에 의해, 쿠벤의 삶이 송두리째 흔들리기 시작했다.<br><br><br><b>&lt;출판사 서평&gt;</b><br><br>“자요.”<br><br>공작 영애가 권했다. 께름칙하지만, 그녀의 가는 손가락에 잡힌 한 조각을 받아 들었다. 아직 맛보지도 않았는데, 입 안에서는 군침의 파도가 일었다.<br>잔뜩 기대한 눈빛. 페시아와 레몬을 번갈아 쳐다본 쿠벤이 두 눈 딱 감고, 하는 수 없이 삼켰다.<br>그가 어금니로 레몬을 씹었다. 불투명하고 얇은 피막이 찢어지며 새콤한 과즙이 터졌다. 과일이 혀를 시게 적시며 존재감을 과시했다.<br>말 그대로 시다. 두 눈이 절로 찡그려질 만큼 새큼하다. 어금니 안쪽에 벗겨진 살덩이가 따가울 정도로.<br><br>“윽.”<br><br>생살이 까뒤집히는 느낌에 헛숨을 들이켰지만, 아가씨가 준 레몬을 뱉지 않기 위해 입을 꾹 다물었다. 열심히 씹으며 아무렇지 않은 척하고 싶었지만, 견딜 수 없을 만큼 시어서 주먹을 꾹 쥐고 말았다.<br><br>종잇장처럼 구겨지는 얼굴. 그 모습을 본 페시아가 잔잔히 웃으며 물었다.<br><br>“신 걸 못 먹어요?”<br>“……예.”<br><br>두 눈을 꼭 감은 쿠벤이 고개를 끄덕였다. 신맛이 강한 음식을 못 먹는가 보다. 마냥 귀여운 이 남자를 어쩌면 좋지.<br>남자는 알맹이를 간신히 삼켰다. 그런 그의 붉은 입술에 레몬즙 한 방울이 맺혔다. 떨어질 듯 말 듯, 달랑거리며 신경을 자극한다. 온 신경이 남자의 입술로 저항 없이 끌려갔다.<br>그의 얼굴이 점점 가까워지는 건 기분 탓인가. 멀게만 느껴지던 얼굴이 시야에 가득하다. 선이 뚜렷한 눈, 코, 입이 더욱 가까워졌다.<br>어느새 발돋움을 하게 됐다. 꽃냄새를 맡고 모여드는 벌과 나비처럼, 눈길을 당기는 방향으로 천천히 다가들다 보면 절대 열리지 않을 것 같은 입술이 굳건히 버티고 있다.<br>레몬 방울이 여전히 위태롭게 흔들렸다. 발간 입매의 가장자리를 붙잡은 채 떨어지지 않는다. 그녀가 남자의 날렵한 턱을 손으로 감쌌다.<br><br>“지금 뭐 하시는…….”<br><br>누가 그녀의 귀에 장막을 드리웠나. 화가의 걸걸한 목소리는 들리지도 않았다. 페시아는 그대로, 무엇에 홀린 것처럼 입술을 포갰다.<br>도도록한 살결이 제자리를 찾아간 퍼즐처럼 감겼다. 새콤달콤한 레몬즙 한 방울이 그녀의 입 안으로 스며들었다. 그를 향한 갈증이 조금은 해소되는 기분이었다.<br>하늘에 걸려 내리쬐는 태양이 두 사람의 코끝과 뺨을 부드럽게 어루만졌다. 그녀의 아래 속눈썹에 밝은 빛이 고였다.<br><br><br><b>&lt;저자 소개&gt;</b><br><br>별샴푸.<br><br>머릿속에 부유하는 생각들을 갈무리하여 다양한 형태의 이야기로 선보입니다.<br>의도하고자 하는 바를 누군가가 알아채 주었을 때, 혹은 이를 대변하는 음악을 발견했을 때 카타르시스를 느끼는 편.<br><br>이메일 :: my2cm510@gmail.com<br>트위터 :: https://twitter.com/Dear_StSp<br>블로그 :: https://blog.naver.com/dear_stsp"|0|1|1|2023-10-12 00:00:00
3885018060|마스터피스 (15세 개정판)|별샴푸|델피뉴|2023-08-11|2023-08-11 06:58:00|서양풍 로판|69|61|98|"<b>&lt;책소개&gt;</b><br><br><img src=""//misc.ridibooks.com/desc.intro/3885018060""/><br><br><strong>*본 작품은 리디 웹소설에서 동일한 작품명으로 15세이용가와 19세이용가로 동시 서비스됩니다.<br>연령가에 따라 일부 장면 및 스토리 전개가 상이할 수 있으니, 연령가를 선택 후 이용해 주시길 바랍니다.</strong><br><br>알파라는 이유로 천대받는 화가, ‘쿠벤 와이어스’.<br>초상화 의뢰를 받은 공작 저택에서 특별한 공작 영애, ‘페시아 키호테’를 만나게 된다.<br><br>“……그쪽, 알파예요?”<br>“예, 알파입니다.”<br><br>쿠벤의 삶은 틀에 박힌 듯 평범했다. 알파이기에 당하는 핍박조차 익숙했다.<br><br>“그렇군요…….”<br><br>페시아를 만나기 전까지는.<br>아가씨는 방금 화가가 한 말을 듣지 못한 사람처럼 굴었다.<br><br>‘정말 아무렇지 않은가?’<br><br>그녀에 의해, 쿠벤의 삶이 송두리째 흔들리기 시작했다.<br><br><br><b>&lt;출판사 서평&gt;</b><br><br>“자요.”<br><br>공작 영애가 권했다. 께름칙하지만, 그녀의 가는 손가락에 잡힌 한 조각을 받아 들었다. 아직 맛보지도 않았는데, 입 안에서는 군침의 파도가 일었다.<br>잔뜩 기대한 눈빛. 페시아와 레몬을 번갈아 쳐다본 쿠벤이 두 눈 딱 감고, 하는 수 없이 삼켰다.<br>그가 어금니로 레몬을 씹었다. 불투명하고 얇은 피막이 찢어지며 새콤한 과즙이 터졌다. 과일이 혀를 시게 적시며 존재감을 과시했다.<br>말 그대로 시다. 두 눈이 절로 찡그려질 만큼 새큼하다. 어금니 안쪽에 벗겨진 살덩이가 따가울 정도로.<br><br>“윽.”<br><br>생살이 까뒤집히는 느낌에 헛숨을 들이켰지만, 아가씨가 준 레몬을 뱉지 않기 위해 입을 꾹 다물었다. 열심히 씹으며 아무렇지 않은 척하고 싶었지만, 견딜 수 없을 만큼 시어서 주먹을 꾹 쥐고 말았다.<br><br>종잇장처럼 구겨지는 얼굴. 그 모습을 본 페시아가 잔잔히 웃으며 물었다.<br><br>“신 걸 못 먹어요?”<br>“……예.”<br><br>두 눈을 꼭 감은 쿠벤이 고개를 끄덕였다. 신맛이 강한 음식을 못 먹는가 보다. 마냥 귀여운 이 남자를 어쩌면 좋지.<br>남자는 알맹이를 간신히 삼켰다. 그런 그의 붉은 입술에 레몬즙 한 방울이 맺혔다. 떨어질 듯 말 듯, 달랑거리며 신경을 자극한다. 온 신경이 남자의 입술로 저항 없이 끌려갔다.<br>그의 얼굴이 점점 가까워지는 건 기분 탓인가. 멀게만 느껴지던 얼굴이 시야에 가득하다. 선이 뚜렷한 눈, 코, 입이 더욱 가까워졌다.<br>어느새 발돋움을 하게 됐다. 꽃냄새를 맡고 모여드는 벌과 나비처럼, 눈길을 당기는 방향으로 천천히 다가들다 보면 절대 열리지 않을 것 같은 입술이 굳건히 버티고 있다.<br>레몬 방울이 여전히 위태롭게 흔들렸다. 발간 입매의 가장자리를 붙잡은 채 떨어지지 않는다. 그녀가 남자의 날렵한 턱을 손으로 감쌌다.<br><br>“지금 뭐 하시는…….”<br><br>누가 그녀의 귀에 장막을 드리웠나. 화가의 걸걸한 목소리는 들리지도 않았다. 페시아는 그대로, 무엇에 홀린 것처럼 입술을 포갰다.<br>도도록한 살결이 제자리를 찾아간 퍼즐처럼 감겼다. 새콤달콤한 레몬즙 한 방울이 그녀의 입 안으로 스며들었다. 그를 향한 갈증이 조금은 해소되는 기분이었다.<br>하늘에 걸려 내리쬐는 태양이 두 사람의 코끝과 뺨을 부드럽게 어루만졌다. 그녀의 아래 속눈썹에 밝은 빛이 고였다.<br><br><br><b>&lt;저자 소개&gt;</b><br><br>별샴푸.<br><br>머릿속에 부유하는 생각들을 갈무리하여 다양한 형태의 이야기로 선보입니다.<br>의도하고자 하는 바를 누군가가 알아채 주었을 때, 혹은 이를 대변하는 음악을 발견했을 때 카타르시스를 느끼는 편.<br><br>이메일 :: my2cm510@gmail.com<br>트위터 :: https://twitter.com/Dear_StSp<br>블로그 :: https://blog.naver.com/dear_stsp"|0|1|0|2023-10-12 00:00:00
3885018972|현명하게 물거품이 되는 법|자감복|델피뉴|2023-08-25|2023-08-25 06:58:00|서양풍 로판|3724|477|92|"<b>&lt;책소개&gt;</b><br><br><img src=""//misc.ridibooks.com/desc.intro/3885018972""/><br><br>“간교한 술수로 사람을 홀려 온 마을을 혼란에 빠트린<br>저 사특한 마물의 핵을 내가 손에 넣었소!”<br><br>믿었던 이의 배신과 되돌릴 수 없는 상실.<br>절벽 아래로 밀쳐진 리테는 영영 깨어나고 싶지 않은 잠을 청한다.<br>그리고 하염없이 꿈속을 헤매던 어느 날,<br>알 수 없는 무언가가 잠든 그녀를 건드렸다.<br><br>“당신이 길드장이야? 보물 사냥꾼이 필요하다던.”<br>“글쎄. 그쪽은 우리가 감당하기에는 너무 버거워.”<br><br>육지를 밟은 리테에겐 잔혹한 사냥꾼이라는 소문이 붙지만<br>길드장은 소문보다 그녀가 가져다주는 것들을 믿게 되고.<br><br>“없는 정보는 만들어서라도 줄게! 우리랑 전속으로 계약하자, 응? 자기야.”<br><br>협력자를 얻은 리테는 잃어버린 전부를 되찾아<br>이번에야말로 물거품이 되어 안식을 찾으리라.<br>분명히 그렇게 다짐했었다.<br><br>“이번에 하나를 찾았잖아요. 나머지를 다 찾게 되면 어떻게 하실 거예요?”<br><br>그 여정을 함께할 이들을 만나기 전까지는.<br><br><br><b>&lt;출판사 서평&gt;</b><br><br>어느새 사람의 모습으로 돌아온 에이벨이 기다렸다는 듯이 리테의 뺨을 감쌌다. 갑작스러운 접촉이었으나 떼어 내거나 밀칠 겨를이 없었다. 다음 순간 반듯한 얼굴이 남은 거리마저 좁혀 들어왔다. 몹시 부드러운 감촉이 이마에 느긋하게 머물렀다가 소리도 없이 멀어졌다.<br>드러난 새하얀 이마에 어떠한 문양이 선명하게 떠올랐다가 사라졌다. 동시에 황홀하게 떠돌던 마력들도 바닥에 새겨진 마법진 안으로 순식간에 쏟아져 들어갔다.<br>리테가 천천히 손을 들어 이마를 매만졌다.<br><br>“……미쳤어?”<br>“그럴 리가요.”<br>“이따위 과정이 필요해?”<br><br>에이벨이 옅은 웃음기가 배인 목소리로 답했다.<br><br>“말했잖아요. 이런 방법밖에 모른다고.”<br><br><br><b>&lt;저자 소개&gt;</b><br><br>자감복"|0|1|0|2023-10-13 00:00:00
3885019576|술주정뱅이 NPC로 살아남는 법|내이말|델피뉴|2023-09-08|2023-09-08 06:58:00|서양풍 로판|4552|221|98|<b>&lt;책소개&gt;</b><br><br>어느 날, 오픈 월드 게임 '영웅 체험기'의 NPC에 빙의했다.<br><br>띠링!<br><br>[ 알코올 충족도 30% 미만 !! 보충이 시급합니다 !! ˃̣̣̣̣̣̣︿˂̣̣̣̣̣̣ ]<br><br>“술, 술 갖고 와!”<br><br>하필이면, 술주정뱅이 캐릭터에 말이다.<br><br>뿐만이랴. 이 NPC는 첫 번째 메인스토리에서 희생당하는 운명.<br><br>나는 실종을 막기 위해 이 게임의 주인공, 용사에게 빌붙기로 했다.<br>더불어.<br><br>“자자, 이 누나가 이 기회에 제대로 알려준다.”<br><br>잘생긴 얼굴에,<br><br>“가슴이 미칠 듯이 화났잖아!”<br><br>조각한 듯 완벽한 몸매에,<br><br>“#댕댕남?”<br><br>어쩐지 순진해 보이는 용사로, 묵혀 두었던 내 로망도 실현해 보고 말이야.<br><br><br><b>&lt;출판사 서평&gt;</b><br><br>이안이 눈을 데구루루 굴렸다. 하지만 여기서 물러날 수는 없었다. 애초에 그녀를 주시하라는 신의 계시를 받은 후부터, 매일같이 그녀를 찾아다녔다. 그런 와중에 새로운 계시까지 내려왔으니, 그녀를 계속 옆에 두어야 했다.<br>하지만 무슨 수로? 사실 자기 눈엔 신의 계시라는 것이 보이는데, 그 계시에 따라 만나러 왔다고 말하면, 그녀가 믿을까?<br>절대 그럴 리 없다. 다른 이도 아니고 진짜로 미친 여자에게 미친 남자 취급을 받고 싶지는 않았다. 이안은 계속 머리를 굴렸다. 그 모습이 답답했는지 멜리사의 인상이 구겨졌다. 이윽고 그녀의 입이 슬쩍 열리는, 그때였다.<br><br>“여자, 여자가.”<br>“네?”<br>“모르는, 여자가 자꾸 쫓아와서.”<br><br>이거다.<br>마땅한 답을 찾은 이안이 금세 표정을 갈무리했다.<br><br>“너와 함께 다닌 이후로, 처음 보는 여자들이 말을 걸기 시작했다.”<br>“어쩌라…… 네네.”<br>“그런데 어느 날부터…… 자꾸 누가 따라오는 기분이 들더군.”<br><br>이안은 눈을 내리깔며 말을 이었다. 거짓말은 아니었지만, 그것이 멜리사를 찾아온 이유는 아니었기에 양심이 조금 찔린 탓이다.<br><br>“누가 날 감시한다는 건 썩 좋은 기분은 아니더군. 하지만 일반인을, 그것도 여자를 위협할 수는 없으니까.”<br>“…….”<br>“그래서 네 도움이 필요하단 거다.”<br><br>멜리사는 눈을 깜빡였다.<br>그녀가 자주 읽던 소설과 웹툰에 자주 등장했던 장면들이 머릿속에 떠올랐다.<br><br>&lt;우리는 계약으로 맺어진 관계다.&gt;<br>&lt;일 년. 서로의 이득을 위해 맺어진 계약은 일 년이었다.&gt;<br>&lt;조항 첫 번째. 사랑하지 않을 것.&gt;<br><br>떠오르는 무수한, ‘그’ 내용의 문장들이 머릿속을 떠다녔지만 멜리사는 인정하고 싶지 않았다. 저 또라이 용사는 북부대공 롤이라기엔 너무 어리벙벙했고, 황태자 롤이라기엔 찬란한 금발도, 능글맞은 성격도 아니었으며, 소꿉친구 롤이라기엔 이제 겨우 두 번째 만남이었으니까.<br>그나마 얼굴이 장점이긴 하지만, 그건 남주라면 필수로 갖추어야 할 디폴트값이 아닌가.<br>시답잖은 생각을 멈춘 멜리사는 아무것도 모르겠다는 얼굴로 물었다.<br><br>“아무리 생각해도 그 일에 제가 어떤 도움이 될지 잘 모르겠는데요…….”<br><br>멜리사를 바라보는 이안이 낮은 한숨을 뱉었다. 그게 꼭 ‘그것도 못 알아먹냐.’라는 의미 같아서 멜리사는 울컥했지만, 그래도 혼자 지레짐작해서 민망한 상황이 오는 것보다는 낫다는 생각이 들었다.<br>무엇보다 저 용사는…….<br><br>“너는 먼저 나와 존맛탱 술집에 가면 된다.”<br><br>여자 보기를 돌같이 하기로 유명한 남자이고.<br><br>“무조건 옆에서 걷고, 필요하다면 약간의 접촉까지는 하는 걸로.”<br><br>아무리 예쁜 여자가 저돌적인 대시를 해도 무시로 일관한다고 했으며.<br><br>“축제 내내 그렇게 거리를 같이 걸으면 되겠지. 일종의…….”<br><br>자신을 따라다니는 여자를 곤혹스러워할 만큼 섬세한 성정을 가진 남자도 아닌…….<br><br>“연인 행세, 뭐 비슷한 걸 하면 된다.”<br><br>젠장.<br>끝없이 부정했지만, 멜리사의 예감은 틀리지 않았다는 것을 이안의 말이 증명해 주고 말았다.<br><br><br><b>&lt;저자 소개&gt;</b><br><br>내이말<br>트위터: @saymyname9158|0|1|0|2023-10-13 00:00:00
3885021076|Jilted Guilt : 인어와 사냥꾼|네할렌|델피뉴|2023-09-22|2023-09-22 06:58:00|서양풍 로판|4334|448|72|"<b>&lt;책소개&gt;</b><br><br><img src=""//misc.ridibooks.com/desc.intro/3885021076""/><br><br><strong>*본 작품은 리디 웹소설에서 동일한 작품명으로 15세이용가와 19세이용가로 동시 서비스됩니다.<br>연령가에 따라 일부 장면 및 스토리 전개가 상이할 수 있으니, 연령가를 선택 후 이용해 주시길 바랍니다.</strong><br><br>수렁에 빠진 사내를 건져 올릴 수 있는 말 한마디가 어찌나 그렇게 어려운지.<br><br>“당신의 아내를…… 살릴 수 있어요.”<br><br>어설픈 동정이기도 하고, 이상한 죄책감이기도 했다.<br><br>***<br><br>“어떻게 하면 네가 내 말을 믿을 수 있을까?”<br><br>놀란 살갗은 불길에 지진 듯 달아올랐다. 바닥에 흐드러진 물빛 머리카락이 별빛에 반짝였다.<br><br>“난 네가 필요해.”<br><br>씻어 내리지 못한 미련에 심장이 아렸다. 바닷물 같은 마음이 턱 끝까지 차올라, 그 혼란 속에 잠겨 죽고 싶어졌다.<br><br>“오로지 너 하나만.”<br><br>로샌더가 끝내 내뱉지 않을 그 말이, 비로소 그의 진심인 것 같아서.<br><br>그러나 그만두어야 한다, 이런 건. <br><br>자명하다. 그의 발걸음이 어디로 향할지도, 제 기다림이 얼마나 덧없는지도.<br><br>“당신도 나를 조금은 가여워했던 것처럼 나도 그랬던 거예요.”<br><br>당신을 사랑하는 게 아니다. 레뷔스는 보답받을 수 없는 마음을 부정하며 희미하게 웃었다. 로샌더는 저를 통해 누구를 투영하고 있었을지 모르는 바가 아니다. 그런 기만은 사랑이 될 수 없다.<br><br><br><b>&lt;출판사 서평&gt;</b><br><br>제 목을 겨누었던 칼을 손에 쥐고 있자니 이상했다. 로샌더의 무덤덤한 표정을 보니 더 그랬다.<br><br>“날 죽이려고 썼던 거네요.”<br><br>칼은 칼일 뿐인데, 고작 칼 따위에 의미를 담아 두는 건 우스운 일일까. 속이 울렁거렸다.<br><br>“그땐 그랬지.”<br><br>로샌더는 저를 죽이려 했던 것을 말하는 데 거리낌이 없어 보였다. 사냥꾼이라면 으레 그런 건가? 실제로 죽이지 않았으니, 죽이려 들었던 의도 자체에 매몰된 저 자신이 이상한 건가.<br><br>“지금은 네게 더 필요하겠다 싶어서.”<br>“그래요?”<br><br>그녀는 시리게 빛나는 칼끝을 로샌더에게 겨누어 보았다.<br><br>“워, 지금 쓰라는 말은 아닌데.”<br><br>목에 거의 닿을 것 같은 거리에도 로샌더는 꼼짝도 않고 웃었다.<br><br><br><b>&lt;저자 소개&gt;</b><br><br>네할렌"|0|1|1|2023-10-13 00:00:00
3885021088|Jilted Guilt : 인어와 사냥꾼 (15세 개정판)|네할렌|델피뉴|2023-09-22|2023-09-22 06:58:00|서양풍 로판|88|41|71|"<b>&lt;책소개&gt;</b><br><br><img src=""//misc.ridibooks.com/desc.intro/3885021088""/><br><br><strong>*본 작품은 리디 웹소설에서 동일한 작품명으로 15세이용가와 19세이용가로 동시 서비스됩니다.<br>연령가에 따라 일부 장면 및 스토리 전개가 상이할 수 있으니, 연령가를 선택 후 이용해 주시길 바랍니다.</strong><br><br>수렁에 빠진 사내를 건져 올릴 수 있는 말 한마디가 어찌나 그렇게 어려운지.<br><br>“당신의 아내를…… 살릴 수 있어요.”<br><br>어설픈 동정이기도 하고, 이상한 죄책감이기도 했다.<br><br>***<br><br>“어떻게 하면 네가 내 말을 믿을 수 있을까?”<br><br>놀란 살갗은 불길에 지진 듯 달아올랐다. 바닥에 흐드러진 물빛 머리카락이 별빛에 반짝였다.<br><br>“난 네가 필요해.”<br><br>씻어 내리지 못한 미련에 심장이 아렸다. 바닷물 같은 마음이 턱 끝까지 차올라, 그 혼란 속에 잠겨 죽고 싶어졌다.<br><br>“오로지 너 하나만.”<br><br>로샌더가 끝내 내뱉지 않을 그 말이, 비로소 그의 진심인 것 같아서.<br><br>그러나 그만두어야 한다, 이런 건. <br><br>자명하다. 그의 발걸음이 어디로 향할지도, 제 기다림이 얼마나 덧없는지도.<br><br>“당신도 나를 조금은 가여워했던 것처럼 나도 그랬던 거예요.”<br><br>당신을 사랑하는 게 아니다. 레뷔스는 보답받을 수 없는 마음을 부정하며 희미하게 웃었다. 로샌더는 저를 통해 누구를 투영하고 있었을지 모르는 바가 아니다. 그런 기만은 사랑이 될 수 없다.<br><br><br><b>&lt;출판사 서평&gt;</b><br><br>제 목을 겨누었던 칼을 손에 쥐고 있자니 이상했다. 로샌더의 무덤덤한 표정을 보니 더 그랬다.<br><br>“날 죽이려고 썼던 거네요.”<br><br>칼은 칼일 뿐인데, 고작 칼 따위에 의미를 담아 두는 건 우스운 일일까. 속이 울렁거렸다.<br><br>“그땐 그랬지.”<br><br>로샌더는 저를 죽이려 했던 것을 말하는 데 거리낌이 없어 보였다. 사냥꾼이라면 으레 그런 건가? 실제로 죽이지 않았으니, 죽이려 들었던 의도 자체에 매몰된 저 자신이 이상한 건가.<br><br>“지금은 네게 더 필요하겠다 싶어서.”<br>“그래요?”<br><br>그녀는 시리게 빛나는 칼끝을 로샌더에게 겨누어 보았다.<br><br>“워, 지금 쓰라는 말은 아닌데.”<br><br>목에 거의 닿을 것 같은 거리에도 로샌더는 꼼짝도 않고 웃었다.<br><br><br><b>&lt;저자 소개&gt;</b><br><br>네할렌"|0|1|0|2023-10-13 00:00:00
4287001581|그의 아이를 바란 적 없다|구름에 숨은 달|라이즈|2023-08-15|2023-08-15 06:58:00|서양풍 로판|2952|740|124|<b>&lt;책소개&gt;</b><br><br>죽고 싶었다.<br>그러나 에밀리아는 마음대로 죽지도 못한 채 강제로 반역자의 아내가 되었다.<br><br>더 이상 절망할 것도 없다고 생각했을 때 그의 아이를 낳으라는 국왕의 말도 안 되는 명령이 떨어졌다.<br><br>증오는 끝없이 피어올랐다.<br><br>“그러니 아이를 가져. 에밀리아 폰 하인리히.”<br>“도대체 우리가 무슨 사이죠?”<br>“나는 그대에게 씨를 뿌리고, 그대는 내 씨물을 받아서 아이를 배는, 필요에 의해 서로를 수단으로 이용하는 사이.”<br><br>그가 내린 정의는 간단했다.<br><br>그러나 증오로 타오르는 감정은 그와 밤을 보낼수록, 그에 대해 알게 될수록 희미해졌다.<br><br>이윽고 진실에 가까워지는 순간, 그녀는 그의 아이를 품은 채 달아났다.<br>더는 그를 증오할 수도 미워할 수도 없었으니까.<br><br>그녀가 떠난 후 오만했던 남자는 후회에 울부짖었다.<br>미하일 역시 그녀를 증오할 수도 미워할 수도 없는 몸이 되었기에.<br><br>※ 이 책에는 강압적인 관계에 대한 묘사가 포함되어 있습니다. 구매에 주의 부탁드립니다. 감사합니다.|0|1|1|2023-10-14 00:00:00
4375024290|백작 영애의 던전 생활|시나몬|에클라|2023-07-14|2023-07-14 06:58:00|서양풍 로판|2807|501|136|<b>&lt;책소개&gt;</b><br><br>리체 리레일은 변경백의 귀한 외동딸이다.<br>변경백의 자리에 오를 남편을 맞이하고, 백작가를 이을 아이를 낳고, 리레일 령에서 귀하신 몸으로 불리며 저잣거리의 고생이라곤 모른 채 귀애당할 영애.<br>…였다.<br><br>세상이 던전에 뒤덮이기 전까지는.<br><br>귀족의 권세도 제국의 법률도 땅에 떨어지고,<br>당장의 생존만을 바라보게 된 던전 아포칼립스.<br>…에서도 리체 리레일의 삶은 생각보다 편안했다.<br><br>6년 만에 만난 소꿉친구이자 전 ‘대공가의 후계자’, 바샤 아이자르에게 납치당하기 전까지는.<br><br> * * *<br><br>‘아니, 보통 이런 상황은 생각 안 하지.’<br>잘 지내던 소꿉친구에게 난데없이 뒤통수를 맞는 상황 같은 게……. 예상하기 쉽냔 말이다. 그렇게 ‘나의 리체’ 같은 소리를 하는 녀석에게.<br>“나와 떠날 건지 여기 남을 건지 정하랬지.”<br>힘이 남아 있는 손발을 움직이려 들자 빌이 잽싸게 팔다리를 묶었다. 손발을 묶인 리체를 공주님처럼 안은 바샤가 속삭였다.<br>“미안하다, 리체. 본의 아니게 널 속였군.”<br>그는 오른쪽 옆머리의 한 줄기 땋은 머리를 묶어 둔 리본에 입을 맞췄다. 그가 선물한 리본이었다.<br>“네 미래는 하나밖에 없어. 나는 무엇 하나 포기하지 않는 남자니까.”<br><br><br><b>&lt;저자 소개&gt;</b><br><br>유쾌한 이야기가 좋아요.|0|1|1|2023-10-14 00:00:00
