3000007903|말하는 대로 될지어다 (15세 개정판)|블랙타이거|달리아(스토리숲)|2023-05-25|2023-05-25 06:58:00|서양풍 로판|65|102|168|"<b>&lt;책소개&gt;</b><br><br><video src=""https://www.youtube.com/watch?v=7kvipsF-iVw""/><br><br>※본 작품은 리디 웹소설에서 동일한 작품명으로 15세 이용가와 19세 이용가로 동시 서비스됩니다. 연령가에 따른 일부 장면 및 스토리 전개가 상이할 수 있으니, 연령가를 선택 후 이용해 주시기 바랍니다.<br><br>붉은 머리카락, 붉은 눈동자, 붉은 입술.<br>신의 피를 마시고 태어난 자들만이 갖는다는 축복의 증거.<br>내뱉는 말을 곧 현실로 만든다는, ‘언령사’.<br><br>***<br><br>발칙한 입술로 언령을 뱉어 제 아버지를 죽인 원수,<br>단지 그뿐이라고 생각했다.<br><br>“로즈.”<br><br>그녀에게 ‘언령사’가 아닌 이름을 지어 주고 싶게 되고.<br><br>“그게 네 이름이야.”<br><br>그녀를 사랑하게 되기 전까진.<br><br><br><b>&lt;저자 소개&gt;</b><br><br>필명 : 블랙타이거"|0|1|0|2023-10-13 00:00:00
3000008972|내 소설 속에는 집착 남주들이 산다|박나희|달리아(스토리숲)|2023-09-15|2023-09-15 06:58:00|서양풍 로판|2955|656|93|"<b>&lt;책소개&gt;</b><br><br><video src=""https://youtu.be/2UbR98BT1W8?si=ZFQGIEONxLzgTrT8""/><br><br><img src=""//misc.ridibooks.com/desc.intro/3000008972""/><br><br>19금 피폐물, 즉 여주인공이 데굴데굴 구르고 씬이 난무한 역하렘을 즐겨 쓰는 작가, 린아는<br>배드 엔딩을 맞은 여주인공의 저주로 인해 소설 속으로 끌려 들어와 델리니아가 되었다.<br>그것도 모자라 게임 형식으로 바뀐 소설은 린아에게 델리니아의 삶을 다시 개척하라는 퀘스트를 주었는데…….<br>문제는 그녀 자신이 만든 남주들이 정상이 아니라는 것이다.<br><br>“누가 보면 내가 공녀를 겁탈이라도 하는 줄 알겠어.”<br>“네가 궁금해. 네 몸도, 마음도, 머릿속도, 너의 내장부터 흐르는 피까지 모두 다.”<br>“무모하게 날려고 하지 마십시오. 아가씨는 제 품에 계셔야 가장 안전합니다.”<br><br>린아는 델리니아의 해피 엔딩을 위해 위험한 남주들을 공략하기로 했다.<br>물론, 순수한 작가의 마음으로?<br><br><br><b>&lt;저자 소개&gt;</b><br><br>삼겹살 넣은 김치찌개를 가장 좋아합니다."|0|1|1|2023-10-14 00:00:00
3007000031|이리나|임세아|RedGem|2017-10-12|2017-10-11 12:22:21|서양풍 로판|3|69|52|<b>&lt;책소개&gt;</b><br><br>남편인 유그리드와 죽고 못사는 원수 지간으로 십 년을 보낸 이리나.<br>그런데, 그게 다 오해였단다. <br>급히 유그리드를 찾아 달려갔지만 이미 싸늘한 주검이 되어 버린 그. <br>지난 잘못을 후회하며 과거를 되짚던 이리나는 어느날, 시간이 되돌려졌음을 알게 되는데…<br><br>그런데, 알고 보니 두 사람 모두 회귀했다…?<br><br><br><b>&lt;저자 소개&gt;</b><br><br>다양한 로맨스를 쓰고 싶은 글쟁이.<br>부족한 점이 많지만 잘 부탁드립니다.|0|0|0|2018-02-07 00:00:00
3026000001|이스닐다|리모란|로즈엔|2017-10-12|2017-10-11 12:21:13|서양풍 로판|2264|2808|346|"<b>&lt;책소개&gt;</b><br><br><video src=""https://www.youtube.com/watch?v=2TkPR6FwsM4""/><br><br>부모님을 잃고 7년간 친척집에서 구박데기로 자란 고아 소녀 이스닐다.<br>어느 날 아버지의 재산을 가로챘던 남자가 나타나 그녀에게 거액의 상속금을 넘긴다.<br>하루아침에 억만장자가 되었으니 이제 꽃길만 걸으면 되는 줄 알았는데…?<br><br>“어떤 남자가 좋아? 내가 맞추지, 뭐.”<br><br>날 처음 보는 척하는 소꿉친구 기사에,<br><br>“제가 당신에게 주는 건 뭐든 가장 좋은 것이어야 합니다.”<br><br>날 방치해 놓고 이제 와서 친절하게 구는 수상한 사업가까지.<br><br>부자 라이프도 의외로 쉽지가 않다?<br><br><strong>그녀를 가장 좋아하는 남자</strong>와 <strong>그녀 말고는 아무도 좋아하지 않는 남자</strong><br>둘 사이에서 꼬이고 꼬여 가는 <strong>삼각관계 애증 판타지</strong><br><br>일러스트: 튜훗<br><br><br><b>&lt;저자 소개&gt;</b><br><br>저자 - 리모란<br><br>레몬맛쿠키와 오렌지맛쿠키를 좋아합니다. 둘을 합쳐 리모란입니다.<br><br>&lt;출간작&gt;<br><br>왕세자비 오디션."|0|1|0|2022-09-30 00:00:00
3049031140|죽도록 후회하면서 울어 봐|도얼음|에이블|2022-10-29|2022-10-29 06:58:00|서양풍 로판|3086|1133|173|<b>&lt;책소개&gt;</b><br><br>피폐 역하렘 게임 속 ‘백신 프로그램’으로 태어난 성녀, 다프넬라.<br>그리고 그녀에게 엉겨드는 굴지의 집착광견들.<br><br>“너는 내 것이다. 네 몸, 네 목숨, 네 능력, 네가 쉬는 숨 한 자락까지 전부 다.” <br>소유욕으로 반쯤 미쳐 버린 황태자, 하이젠.<br><br>“어떻게 해야 저를 돌아보시겠습니까. 교황과 추기경들의 목이라도 뜯어오면 될까요?”<br>고결한 얼굴로 배덕을 속삭이는 성기사단장, 뷔레스턴.<br><br>“착각하지 마라. 절대 너를 걱정하는 건 아니니까. 그래서, 너한테 손댄 놈이 누구라고?”<br>시도 때도 없이 짖어 대는 다혈질 소공작, 록산드.<br><br>올무처럼 조여 오는 속박 속에서 다프넬라는 간절히 바랐다.<br>이깟 세상, 전부 망해 버렸으면 좋겠다고.<br><br>그런 그녀 앞에 검은 바이러스를 품은 비밀스러운 남자가 손을 내민다.<br><br>“드디어 찾았군, 다프넬라.”<br><br>결코 서로 융화될 수 없는 존재.<br>그러나 서로만이 서로를 알아볼 수 있는 운명.<br>백신과 바이러스로 만난 두 사람.<br><br>“내가 그대를 낙원에 가두겠다면, 따라올 텐가.”<br><br>이 남자는 정녕 낙원일까.<br>혹은 더없이 잔혹한 나락일까.<br><br>당신의 손을 잡으면,<br>이 빌어먹을 세상을 어디까지 무너뜨릴 수 있지?|0|1|0|2023-10-13 00:00:00
3049038154|당신의 최선은 후회로 돌아오고|임모루|에이블|2023-05-16|2023-05-16 06:58:00|서양풍 로판|3007|360|109|<b>&lt;책소개&gt;</b><br><br><strong>*본 작품은 리디북스에서 동일한 작품명으로 19세이용가와 15세이용가로 동시 서비스됩니다. 연령가에 따른 일부 장면 및 스토리 전개가 상이할 수 있으니, 연령가를 선택 후 이용해 주시길 바랍니다.</strong><br><br><br>자그마치 삼 년이었다.<br>그와 떨어져 있던 내내 이자벨은 죽지 못해 살았다.<br>하나 정말 죽어서는 안 되었다. <br>그녀에겐 혼인을 약조한 연인, 아르노가 있었으니까.<br><br>하여 살았다. 이를 악물고 살았다.<br>적국의 왕에게 희롱당해도, 그의 비에게 뺨을 맞아도 살았다.<br>버티고 버틴 끝에 드디어 만난 아르노이건만,<br><br>“이자벨, 당신을 증오합니다.”<br><br>그토록 사랑했던 이가 자신을 증오한단다.<br>정부와 입을 맞추었던 그 혀로, 아르노는 수없는 독설을 퍼부었다.<br>그럼에도 이자벨은 그를 사랑하는 것을 멈출 수 없었다.<br><br>하지만 사랑은 무한하지 못했다.<br>아르노를 바라볼수록 그녀는 문드러졌다.<br>이자벨이 그것을 더 이상 외면할 수 없게 되었을 즈음,<br><br>“그대를 위해 목숨까지 내걸고 왔다 말하면, 이자벨 당신은 믿을까요.”<br><br>아르노의 사랑은 다시 시작되었다.|0|1|1|2023-10-13 00:00:00
3049038164|당신의 최선은 후회로 돌아오고 (15세 개정판)|임모루|에이블|2023-05-16|2023-05-16 06:58:00|서양풍 로판|68|76|108|<b>&lt;책소개&gt;</b><br><br><strong>*본 작품은 리디북스에서 동일한 작품명으로 15세이용가와 19세이용가로 동시 서비스됩니다. 연령가에 따른 일부 장면 및 스토리 전개가 상이할 수 있으니, 연령가를 선택 후 이용해 주시길 바랍니다.</strong><br><br><br>자그마치 삼 년이었다.<br>그와 떨어져 있던 내내 이자벨은 죽지 못해 살았다.<br>하나 정말 죽어서는 안 되었다. <br>그녀에겐 혼인을 약조한 연인, 아르노가 있었으니까.<br><br>하여 살았다. 이를 악물고 살았다.<br>적국의 왕에게 희롱당해도, 그의 비에게 뺨을 맞아도 살았다.<br>버티고 버틴 끝에 드디어 만난 아르노이건만,<br><br>“이자벨, 당신을 증오합니다.”<br><br>그토록 사랑했던 이가 자신을 증오한단다.<br>정부와 입을 맞추었던 그 혀로, 아르노는 수없는 독설을 퍼부었다.<br>그럼에도 이자벨은 그를 사랑하는 것을 멈출 수 없었다.<br><br>하지만 사랑은 무한하지 못했다.<br>아르노를 바라볼수록 그녀는 문드러졌다.<br>이자벨이 그것을 더 이상 외면할 수 없게 되었을 즈음,<br><br>“그대를 위해 목숨까지 내걸고 왔다 말하면, 이자벨 당신은 믿을까요.”<br><br>아르노의 사랑은 다시 시작되었다.|0|1|0|2023-10-13 00:00:00
3049042517|길티 메리지|Magoing|에이블|2023-09-14|2023-09-14 06:58:00|서양풍 로판|2948|703|78|<b>&lt;책소개&gt;</b><br><br><strong>*본 작품은 리디북스에서 동일한 작품명으로 19세이용가와 15세이용가로 동시 서비스됩니다. 연령가에 따른 일부 장면 및 스토리 전개가 상이할 수 있으니, 연령가를 선택 후 이용해 주시길 바랍니다.</strong><br><br><br>“말했잖아. 언젠가 이런 날이 반드시 올 거라고.”<br> <br>낡고 지저분한 방, 먼지가 까맣게 붙은 가구들, 흐릿하고 금이 간 거울.<br><br>레아의 모든 것은 오웬과 달랐다. 그의 금화 같은 머리카락, 보석 같은 녹색의 눈동자. 오웬의 손발은 하얬고 손톱 끝마저 빛이 났다.<br><br>아버지가 훔친 아이. 반짝거리고 아름답고 고귀한 그 애가 지저분한 이곳에 있는 매 순간이 레아 안의 죄책감을 키웠다. 그래서 어린 오웬을 돌려 보냈을 때 레아는 그것이 옳은 일이라 믿었다.<br><br>그러나 홀로 살아가던 레아의 작고 낡은 방에 오웬이 다시 찾아왔다.<br><br>“레아 펠. 내 아내가 되어줘.”<br><br>이제 어린 아이가 아니라 성인이 된 청년의 모습으로 찾아온 그는 레아에게 그녀의 아버지를 찾기 위한 미끼가 되어 달라 요구했다. 자신과 결혼하여 욕심 많은 아버지를 불러들여 달라고.<br><br>“난 그 누구보다 널 제일 용서할 수 없어.”<br>“……미안해, 오웬.”<br><br>레아는 죄책감에 그 요구를 수락했고 그와 함께 다시 수도로 돌아갔다. <br><br>그러나 죄책감으로 얼룩진 결혼 생활은 오웬이 숨기던 사실이 드러나자 산산조각나게 된다.|0|1|1|2023-10-14 00:00:00
3049042527|길티 메리지 (15세 개정판)|Magoing|에이블|2023-09-14|2023-09-14 06:58:00|서양풍 로판|76|57|72|<b>&lt;책소개&gt;</b><br><br><strong>*본 작품은 리디북스에서 동일한 작품명으로 15세이용가와 19세이용가로 동시 서비스됩니다. 연령가에 따른 일부 장면 및 스토리 전개가 상이할 수 있으니, 연령가를 선택 후 이용해 주시길 바랍니다.</strong><br><br><br>“말했잖아. 언젠가 이런 날이 반드시 올 거라고.”<br> <br>낡고 지저분한 방, 먼지가 까맣게 붙은 가구들, 흐릿하고 금이 간 거울.<br><br>레아의 모든 것은 오웬과 달랐다. 그의 금화 같은 머리카락, 보석 같은 녹색의 눈동자. 오웬의 손발은 하얬고 손톱 끝마저 빛이 났다.<br><br>아버지가 훔친 아이. 반짝거리고 아름답고 고귀한 그 애가 지저분한 이곳에 있는 매 순간이 레아 안의 죄책감을 키웠다. 그래서 어린 오웬을 돌려 보냈을 때 레아는 그것이 옳은 일이라 믿었다.<br><br>그러나 홀로 살아가던 레아의 작고 낡은 방에 오웬이 다시 찾아왔다.<br><br>“레아 펠. 내 아내가 되어줘.”<br><br>이제 어린 아이가 아니라 성인이 된 청년의 모습으로 찾아온 그는 레아에게 그녀의 아버지를 찾기 위한 미끼가 되어 달라 요구했다. 자신과 결혼하여 욕심 많은 아버지를 불러들여 달라고.<br><br>“난 그 누구보다 널 제일 용서할 수 없어.”<br>“……미안해, 오웬.”<br><br>레아는 죄책감에 그 요구를 수락했고 그와 함께 다시 수도로 돌아갔다. <br><br>그러나 죄책감으로 얼룩진 결혼 생활은 오웬이 숨기던 사실이 드러나자 산산조각나게 된다.|0|1|0|2023-10-14 00:00:00
3228062220|오직 당신의 아래에서|불량판다|로제토|2023-10-11|2023-10-11 06:58:00|서양풍 로판|3088|253|82|<b>&lt;책소개&gt;</b><br><br>※본 작품은 리디 웹소설에서 동일한 작품명으로 19세 이용가와 15세 이용가로 동시 서비스됩니다. 연령가에 따른 일부 장면 및 스토리 전개가 상이할 수 있으니, 연령가를 선택 후 이용해 주시길 바랍니다.<br><br>괴물이라 하기엔 너무나 아름다운 존재.<br>그러나 그 모습에 홀리기엔, 주변은 참혹하기 그지없었다.<br><br>한평생, 놈을 죽이겠다는 일념하에 성기사의 단장까지 올라간 에린.<br>어느 날 마신의 짓이라 추측되는 기이한 현상들이 일어난다.<br><br>복수의 기회가 왔음에도 압도적인 힘에 굴복당해 아무것도 하지 못하는 절망에 휩싸였던 그때.<br>은의 마신, 가브리엘이 비웃듯 나타나 에린의 인생을 송두리째 흔들기 시작한다.<br><br>“나의 조건은 하나뿐이란다. 밤의 마신이 죽기 전까지, 이틀에 한 번, 내가 원하는 만큼의 피를 주는 것.”<br>“피는 오늘부터 주면 되는 것인가.”<br><br>끔찍하리만큼 달콤한 제안이었다.<br><br>***<br><br>그는 되레 자신의 목을 조르는 손에 제 손을 겹쳤다.<br>참으로 서늘한 죽음의 손이 그녀가 타락의 길을 걸을 수 있도록 친절히 안내를 해 주고 있었다.<br><br>숨도 제대로 쉬지 못하면서, 다정하면서도 유혹적인 말을 해 오고 있었다.<br><br>“이렇게 해야 죽어.”<br><br>어서 빨리 자신을 죽이라는 악마의 유혹이었다.|0|1|1|2023-10-13 00:00:00
3228062314|오직 당신의 아래에서 (15세 개정판)|불량판다|로제토|2023-10-11|2023-10-11 06:58:00|서양풍 로판|58|31|82|<b>&lt;책소개&gt;</b><br><br>※본 작품은 리디 웹소설에서 동일한 작품명으로 15세 이용가와 19세 이용가로 동시 서비스됩니다. 연령가에 따른 일부 장면 및 스토리 전개가 상이할 수 있으니, 연령가를 선택 후 이용해 주시길 바랍니다.<br><br>괴물이라 하기엔 너무나 아름다운 존재.<br>그러나 그 모습에 홀리기엔, 주변은 참혹하기 그지없었다.<br><br>한평생, 놈을 죽이겠다는 일념하에 성기사의 단장까지 올라간 에린.<br>어느 날 마신의 짓이라 추측되는 기이한 현상들이 일어난다.<br><br>복수의 기회가 왔음에도 압도적인 힘에 굴복당해 아무것도 하지 못하는 절망에 휩싸였던 그때.<br>은의 마신, 가브리엘이 비웃듯 나타나 에린의 인생을 송두리째 흔들기 시작한다.<br><br>“나의 조건은 하나뿐이란다. 밤의 마신이 죽기 전까지, 이틀에 한 번, 내가 원하는 만큼의 피를 주는 것.”<br>“피는 오늘부터 주면 되는 것인가.”<br><br>끔찍하리만큼 달콤한 제안이었다.<br><br>***<br><br>그는 되레 자신의 목을 조르는 손에 제 손을 겹쳤다.<br>참으로 서늘한 죽음의 손이 그녀가 타락의 길을 걸을 수 있도록 친절히 안내를 해 주고 있었다.<br><br>숨도 제대로 쉬지 못하면서, 다정하면서도 유혹적인 말을 해 오고 있었다.<br><br>“이렇게 해야 죽어.”<br><br>어서 빨리 자신을 죽이라는 악마의 유혹이었다.|0|1|0|2023-10-13 00:00:00
3302011086|여름 궁전의 장난감|파우스티니아|텐북|2023-06-09|2023-06-09 06:58:00|서양풍 로판|3044|1250|132|<b>&lt;책소개&gt;</b><br><br>※본 작품은 강압적 관계 및 선정적인 단어, 호불호를 탈 수 있는 내용이 일부 포함되어 있습니다. 이용에 참고 바랍니다.<br><br>지겨운 여름 동안 가지고 놀 아름다운 장난감이 생겼다.<br><br>그해 여름은 젊은 황제 이스칸다르가 즉위한 이래 가장 뜨거웠다.<br>황제로서 처음 피서한 그를 여름 궁전의 하인들은 겁에 질려 모셨다.<br><br>오만한 군주, 냉혹한 압제자, 잔인하고 아름다운 재해.<br>새 황제를 수식하는 말들이 금처럼 찬란하고 철처럼 날카롭기 때문이었다.<br><br>그의 눈에 새로운 장난감이 들어온 것은<br>여름 숲에서의 사냥과 호화로운 향락마저 지겨워질 무렵이었다.<br><br>세니타.<br><br>앞치마에 숯검정이 묻은 비루한 하녀 주제에<br>감히 황제의 시선을 피하지 않는 대담한 여자였다.<br><br>아득한 눈빛으로 오래된 추억을 말하고<br>하찮은 것에 큰 의미를 부여하는 몽상가이기도 했다.<br><br>그래서 좋았다. 재미있어 보였다.<br>무덥고 지루한 이 여름내 저 가련한 여자를 가지고 노는 것도 괜찮을 것 같았다.<br><br>그러고 싶었으므로, 이스칸다르는 그렇게 했다.<br>모든 것이 아주 쉬웠다. 그는 망치는 재주가 탁월한 인간이었으니까.<br><br><br><b>&lt;저자 소개&gt;</b><br><br>myoldrosyfantasy@gmail.com|0|1|1|2023-10-13 00:00:00
3302014936|정략결혼인데 사랑받고 있습니다|금귀|텐북|2023-10-06|2023-10-06 06:58:00|서양풍 로판|2862|324|88|<b>&lt;책소개&gt;</b><br><br>“저는 마탑주가 왜 이 결혼을 원하시는지 모르겠어요. 마탑주는 절…….”<br>“좋아합니다.”<br><br>황녀, 샤를리제는 아버지인 황제에게서 갑작스러운 결혼 통보 소식을 받는다.<br>상대인 마탑주가 자신과의 혼인을 원한다는 이유였다.<br><br>아무리 봐도 자신을 좋아하는 눈치가 아닌데.<br>이 사람, 왜 나하고 결혼한다고 한 거야?<br><br>“황녀. 저와의 키스가 첫 키스입니까?”<br><br>제 꾀에 넘어가 엉겹결에 아킬라즈와 입을 맞추었다.<br>분명 불쾌해하며 밀어냈어야 했는데 왜 그러지 못한 것인지.<br>그리고 심장이 이리도 세차게 뛰는 이유는 무엇인지.<br><br>“제가 만지는 것이 싫습니까?”<br>“아, 아직 결혼한 것도 아니고……. 그, 그런 스킨십은 건전하지 못해요.”<br>“손을 잡는 것과 무엇이 다릅니까?”<br>“달라요! 손은 인사할 때나 춤출 때도 잡지만 얼굴은…….”<br>“그럼 키스는?”<br><br>그리고 이 두근거리는 마음은 아킬라즈 또한 마찬가지인지,<br>사랑을 자각한 순간부터 노골적으로 애정을 표한다.<br><br>“…뜨겁습니다. 이건 저 때문입니까?”<br><br>어떻게 하지? 지금 나… 행복한 것 같아.|0|1|1|2023-10-14 00:00:00
3302014937|정략결혼인데 사랑받고 있습니다 (15세 이용가)|금귀|텐북|2023-10-06|2023-10-06 06:58:00|서양풍 로판|72|36|88|<b>&lt;책소개&gt;</b><br><br>“저는 마탑주가 왜 이 결혼을 원하시는지 모르겠어요. 마탑주는 절…….”<br>“좋아합니다.”<br><br>황녀, 샤를리제는 아버지인 황제에게서 갑작스러운 결혼 통보 소식을 받는다.<br>상대인 마탑주가 자신과의 혼인을 원한다는 이유였다.<br><br>아무리 봐도 자신을 좋아하는 눈치가 아닌데.<br>이 사람, 왜 나하고 결혼한다고 한 거야?<br><br>“황녀. 저와의 키스가 첫 키스입니까?”<br><br>제 꾀에 넘어가 엉겹결에 아킬라즈와 입을 맞추었다.<br>분명 불쾌해하며 밀어냈어야 했는데 왜 그러지 못한 것인지.<br>그리고 심장이 이리도 세차게 뛰는 이유는 무엇인지.<br><br>“제가 만지는 것이 싫습니까?”<br>“아, 아직 결혼한 것도 아니고……. 그, 그런 스킨십은 건전하지 못해요.”<br>“손을 잡는 것과 무엇이 다릅니까?”<br>“달라요! 손은 인사할 때나 춤출 때도 잡지만 얼굴은…….”<br>“그럼 키스는?”<br><br>그리고 이 두근거리는 마음은 아킬라즈 또한 마찬가지인지,<br>사랑을 자각한 순간부터 노골적으로 애정을 표한다.<br><br>“…뜨겁습니다. 이건 저 때문입니까?”<br><br>어떻게 하지? 지금 나… 행복한 것 같아.|0|1|0|2023-10-14 00:00:00
3822004982|너드남의 흑화를 막아 보겠습니다|김도온|비포선셋|2022-10-11|2022-10-11 06:58:00|서양풍 로판|3127|1643|263|"<b>&lt;책소개&gt;</b><br><br><video src=""https://youtu.be/8hLycQxa3IM""/><br><br>&lt;세인트 존 칼리지에서 일어난 일&gt;<br>로맨스가 단 1퍼센트 첨가된, 19금 피폐 소설에 빙의했다.<br>하지만, 그녀는 빙의한 소설이 피폐물인들 상관없었다.<br><br>‘원작에서 등장도 안 하는 모브 엑스트라에 빙의시켜 주셔서 감사합니다!’<br><br>등장인물과 접점이라곤 조금도 없을 예정이니까!<br>이후 졸업장을 따고, 달링 후작이 되어 떵떵거리며 살 예정이니까!<br><br>하지만,<br>이게 무슨 운명의 장난인지…….<br><br>‘여기구나. 훗날 그 참극이 벌어지는 곳이…….’<br><br>&lt;포가츠 아카데미&gt;에 입학할 예정이었던 제네비브는<br>모종의 사건으로 인해 &lt;세인트 존 칼리지&gt;에 입학하게 된다.<br><br>그나마 불행인지 다행인지.<br>그녀는 &lt;세인트 존 칼리지&gt;에 입학하고서야 깨달았다.<br>자신이 빙의한 시점이 남주와 여주가 등장하기 전이라는 걸.<br><br>하지만, 그녀가 편안한 마음으로 3학년을 맞았을 때.<br>운명은 그녀의 삶을 뒤바꿀 또 하나의 파란을 불러온다.<br><br>“제네비브 달링 선배, 맞으시죠.”<br><br>장차 대량 학살을 저지를 예정인<br>소설 속 서브 남주가 그녀를 찾아왔으니까!<br><br>그런데…….<br><br>“……신경 쓰게 해서 죄송합니다. 과제에 방해가 되지 않도록 조용히 있을게요.”<br>‘괴롭힘당한 건 넌데, 왜 네가 사과를 해?!’<br><br>……흑막 서브 남주가 순해도 너무 순하다.<br>아무리 그의 어두운 과거 시점이라지만, 이건 너무…….<br><br>그때부터 제네비브는 결심했다.<br><br>제힘으로 원작을 모두 바꾸진 못하더라도<br>에드워드가 나중에 이 시절을 떠올렸을 때<br>하나라도 좋았던 추억을 만들어 주기로!<br><br>“괜찮아, 에드워드. 여기 있어도 돼.”<br><br>장차 흑막이 될 서브남주에게 좋은 추억을 선물하기!<br>제네비브의 목표는 이루어질 수 있을까?"|0|1|0|2023-10-13 00:00:00
